video,obsNum,regular,critical,score,timeStart,timeEnd,Player,context,htn,inflection,abstractLabel,causeLabel,questionLabel,0.892,effectLabel,reasonWhyQuestionLabel,qWord,qPhrase,auxVerb,actionVerb,,,,,,,,,,,,,,,,,,,,,,,,,,,,,,,,,,,,,,,,,,,,,,,,,,,,,,,,,,,,,,,,,,,,,,,,,,,,,,,,,,,,,,,,,,,,,,,,,,,,,,,,,,,,,,,,,,,,,,,,,,,,,,,,,,,,,,,,,,,,,,,,,,,,,,,,,,,,,,,,,,,,,,,,,,,,,,,,,,,,,,,,,,,,,,,,,,,,,,,,,,,,,,,,,,,,,,,,,,,,,,,,,,,,,,,,,,
637,32,9,6,390,2:04,2:01,green,,clarifySomething,yes,clearLocationVictim,collaborateClearLocation,clarifyClearLocation,1,confirmClearLocation,"location instead of area

status is for victims and not for location. use clear.",right,clearedOut,nil,clear,,,,,,,,,,,,,,,,,,,,,,,,,,,,,,,,,,,,,,,,,,,,,,,,,,,,,,,,,,,,,,,,,,,,,,,,,,,,,,,,,,,,,,,,,,,,,,,,,,,,,,,,,,,,,,,,,,,,,,,,,,,,,,,,,,,,,,,,,,,,,,,,,,,,,,,,,,,,,,,,,,,,,,,,,,,,,,,,,,,,,,,,,,,,,,,,,,,,,,,,,,,,,,,,,,,,,,,,,,,,,,,,,,,,,,,,,,
637,33,11,7,460,1:14,1:11,green,transporter and engineer trying to wake up a critical and then realize they need the medic to be one of them,clarifySomething,yes,collaborateCriticalWake,notwakeCritical,clarifyRoleCapabilities,1,confirmRole,asking about specific role capabilities,when,whenWere,has,be,,,,,,,,,,,,,,,,,,,,,,,,,,,,,,,,,,,,,,,,,,,,,,,,,,,,,,,,,,,,,,,,,,,,,,,,,,,,,,,,,,,,,,,,,,,,,,,,,,,,,,,,,,,,,,,,,,,,,,,,,,,,,,,,,,,,,,,,,,,,,,,,,,,,,,,,,,,,,,,,,,,,,,,,,,,,,,,,,,,,,,,,,,,,,,,,,,,,,,,,,,,,,,,,,,,,,,,,,,,,,,,,,,,,,,,,,,
637,34,11,9,560,0:34,0:32,blue,,askInformation,no,collaborateCriticalRoom,noticeCriticalRoom,askCriticalRoom,1,clarifyCriticalRoom,"status is for victims, not rooms or locations. Did not previously ask for room specifics so we don't know if this room is to be cleared. Noticed a critical in the room, so it needs to be asked, about a critical and about a room",did,didYou,did,check,,,,,,,,,,,,,,,,,,,,,,,,,,,,,,,,,,,,,,,,,,,,,,,,,,,,,,,,,,,,,,,,,,,,,,,,,,,,,,,,,,,,,,,,,,,,,,,,,,,,,,,,,,,,,,,,,,,,,,,,,,,,,,,,,,,,,,,,,,,,,,,,,,,,,,,,,,,,,,,,,,,,,,,,,,,,,,,,,,,,,,,,,,,,,,,,,,,,,,,,,,,,,,,,,,,,,,,,,,,,,,,,,,,,,,,,,,
637,35,11,10,610,0:23,0:21,red,asking about j4 being blocked off or if j4 was all clear. The reason they were asking about j4 was because they said there was a critical victim in that room and there was rubble in that room.,clarifySomething,yes,collaborateCriticalRoom,noticeCriticalRoom,clarifyCriticalRoom,0,clarifyCriticalRoom,"status is for victims, not rooms or locations

This utterance is about critical victims in a specific room. Not about any victim. NOt about clearing that room for the purpose of clearing that room. Not about stabiizing for the purpose of stabilizing. I cannot justify this as an agreement, though both labels are correct because:

victim and clear are mutually exclusive, though both labels have clarify and room. If there is a victim or stabilized victim, you cannot state the room is clear. If you ask if a room is clear, you are not specific enough about the clearing referring to a victim, stabilized victim, clearing by area or navigation or destination, by strategy or plan or by rubble. Because both labels are correct but neither capture the full knowledge of the discussion, I created the label ""clarifyCriticalRoom"" for this event.

This is an instance of thinking about intension vs extension-- check with Clay about this!!!",inflection,youSaid,are,say,,,,,,,,,,,,,,,,,,,,,,,,,,,,,,,,,,,,,,,,,,,,,,,,,,,,,,,,,,,,,,,,,,,,,,,,,,,,,,,,,,,,,,,,,,,,,,,,,,,,,,,,,,,,,,,,,,,,,,,,,,,,,,,,,,,,,,,,,,,,,,,,,,,,,,,,,,,,,,,,,,,,,,,,,,,,,,,,,,,,,,,,,,,,,,,,,,,,,,,,,,,,,,,,,,,,,,,,,,,,,,,,,,,,,,,,,,
638,1,0,0,0,16:45,16:43,blue,comparing information pre-mission,askInformation,no,coordinateTeamPlan,shareUniqueKnowledge,collaborateInformationUnique,1,answerUniqueKnowledge,Rule: uniqueInformation==uniqueKnowledge==InformationMission,do,doThose,do,match,,,,,,,,,,,,,,,,,,,,,,,,,,,,,,,,,,,,,,,,,,,,,,,,,,,,,,,,,,,,,,,,,,,,,,,,,,,,,,,,,,,,,,,,,,,,,,,,,,,,,,,,,,,,,,,,,,,,,,,,,,,,,,,,,,,,,,,,,,,,,,,,,,,,,,,,,,,,,,,,,,,,,,,,,,,,,,,,,,,,,,,,,,,,,,,,,,,,,,,,,,,,,,,,,,,,,,,,,,,,,,,,,,,,,,,,,,
638,2,0,0,0,15:53,15:50,red,,clarifySomething,yes,coordinateTeamPlan,shareUniqueKnowledge,clarifyInformationLocation,1,answerUniqueKnowledge,if clarifying location and information and room then question label is clarifyInforamtionLocation,were,youSaid,said,nil,,,,,,,,,,,,,,,,,,,,,,,,,,,,,,,,,,,,,,,,,,,,,,,,,,,,,,,,,,,,,,,,,,,,,,,,,,,,,,,,,,,,,,,,,,,,,,,,,,,,,,,,,,,,,,,,,,,,,,,,,,,,,,,,,,,,,,,,,,,,,,,,,,,,,,,,,,,,,,,,,,,,,,,,,,,,,,,,,,,,,,,,,,,,,,,,,,,,,,,,,,,,,,,,,,,,,,,,,,,,,,,,,,,,,,,,,,
638,3,0,0,0,15:34,15:31,blue,,clarifySomething,no,coordinateTeamPlan,shareUniqueKnowledge,clarifyNavigationTeammate,1,confirmTeamNavigate,primitive matches abstract level,then,thenClear,begin,clear,,,,,,,,,,,,,,,,,,,,,,,,,,,,,,,,,,,,,,,,,,,,,,,,,,,,,,,,,,,,,,,,,,,,,,,,,,,,,,,,,,,,,,,,,,,,,,,,,,,,,,,,,,,,,,,,,,,,,,,,,,,,,,,,,,,,,,,,,,,,,,,,,,,,,,,,,,,,,,,,,,,,,,,,,,,,,,,,,,,,,,,,,,,,,,,,,,,,,,,,,,,,,,,,,,,,,,,,,,,,,,,,,,,,,,,,,,
638,4,0,0,0,15:11,15:09,red,,clarifySomething,yes,clarifyUniqueKnowledge,clarifyTeamPlan,clarifyInformationRoom,1,answerUniqueKnowledge,Asking specifically about information and damage level but higher level is sharing unique information.,are,onlyOne,are,nil,,,,,,,,,,,,,,,,,,,,,,,,,,,,,,,,,,,,,,,,,,,,,,,,,,,,,,,,,,,,,,,,,,,,,,,,,,,,,,,,,,,,,,,,,,,,,,,,,,,,,,,,,,,,,,,,,,,,,,,,,,,,,,,,,,,,,,,,,,,,,,,,,,,,,,,,,,,,,,,,,,,,,,,,,,,,,,,,,,,,,,,,,,,,,,,,,,,,,,,,,,,,,,,,,,,,,,,,,,,,,,,,,,,,,,,,,,
638,5,0,0,0,13:54,13:52,green,,clarifySomething,yes,collaborateCarryStabilized,noticeStabilizedRoom,clarifyStabilizedStatus,1,carryStabilized,"Victims carried and asked about were stabilized. This difference matters in other areas but not for labeling agreement.

The reality is that when asking about stabilized victim status, it is about a specific victim. Because of that specificity, the asking tends not to be general.

I will call this agreement because clarify subsumed by ask (lexical definition, context)

Use clarify when asking about stabilized status (or confirm when aswering)",inflection,areCritical,nil,are,,,,,,,,,,,,,,,,,,,,,,,,,,,,,,,,,,,,,,,,,,,,,,,,,,,,,,,,,,,,,,,,,,,,,,,,,,,,,,,,,,,,,,,,,,,,,,,,,,,,,,,,,,,,,,,,,,,,,,,,,,,,,,,,,,,,,,,,,,,,,,,,,,,,,,,,,,,,,,,,,,,,,,,,,,,,,,,,,,,,,,,,,,,,,,,,,,,,,,,,,,,,,,,,,,,,,,,,,,,,,,,,,,,,,,,,,,
638,6,0,0,0,13:49,13:47,green,,initiateCommitment,no,collaborateCarryStabilized,noticeStabilizedRoom,requestCarryStabilized,1,confirmCarryStabilized,CarryStabiized==CriticalCarry,if,ifYou,want,put,,,,,,,,,,,,,,,,,,,,,,,,,,,,,,,,,,,,,,,,,,,,,,,,,,,,,,,,,,,,,,,,,,,,,,,,,,,,,,,,,,,,,,,,,,,,,,,,,,,,,,,,,,,,,,,,,,,,,,,,,,,,,,,,,,,,,,,,,,,,,,,,,,,,,,,,,,,,,,,,,,,,,,,,,,,,,,,,,,,,,,,,,,,,,,,,,,,,,,,,,,,,,,,,,,,,,,,,,,,,,,,,,,,,,,,,,,
638,7,0,1,50,13:35,13:31,red,,initiateCommitment,no,collaborateThreatRoom,noticeThreatroom,requestBreakrRubble,1,confirmBreakRubble,loren's primitive matches salena's abstract,if,ifYou,want,come,,,,,,,,,,,,,,,,,,,,,,,,,,,,,,,,,,,,,,,,,,,,,,,,,,,,,,,,,,,,,,,,,,,,,,,,,,,,,,,,,,,,,,,,,,,,,,,,,,,,,,,,,,,,,,,,,,,,,,,,,,,,,,,,,,,,,,,,,,,,,,,,,,,,,,,,,,,,,,,,,,,,,,,,,,,,,,,,,,,,,,,,,,,,,,,,,,,,,,,,,,,,,,,,,,,,,,,,,,,,,,,,,,,,,,,,,,
638,8,3,4,230,12:28,12:26,red,,clarifySomething,no,collaborateCriticalRoom,noticeTeammateCritical,clarifyCriticalRoom,1,confirmCriticalRoom,"location instead of area. If area or location in utterance, use location, not room. If room number specified, use room. If series of rooms, use location.",which,whichRoom,did,say,,,,,,,,,,,,,,,,,,,,,,,,,,,,,,,,,,,,,,,,,,,,,,,,,,,,,,,,,,,,,,,,,,,,,,,,,,,,,,,,,,,,,,,,,,,,,,,,,,,,,,,,,,,,,,,,,,,,,,,,,,,,,,,,,,,,,,,,,,,,,,,,,,,,,,,,,,,,,,,,,,,,,,,,,,,,,,,,,,,,,,,,,,,,,,,,,,,,,,,,,,,,,,,,,,,,,,,,,,,,,,,,,,,,,,,,,,
638,9,3,4,230,12:11,12:09,green,,clarifySomething,yes,collaborateCriticalRoom,confirmCriticalRoom,clarifyThreatroom,1,confirmThreatroom,room and Room are typos. Location and threatroom are redundant.,was,youSaid,nil,said,,,,,,,,,,,,,,,,,,,,,,,,,,,,,,,,,,,,,,,,,,,,,,,,,,,,,,,,,,,,,,,,,,,,,,,,,,,,,,,,,,,,,,,,,,,,,,,,,,,,,,,,,,,,,,,,,,,,,,,,,,,,,,,,,,,,,,,,,,,,,,,,,,,,,,,,,,,,,,,,,,,,,,,,,,,,,,,,,,,,,,,,,,,,,,,,,,,,,,,,,,,,,,,,,,,,,,,,,,,,,,,,,,,,,,,,,,
638,10,3,4,230,11:46,11:41,red,"interesting that many times people see a critical victim, they say either 'I need someone to come to this room' or ""i need someone to help me wake this critical'. I need to check the rules formed in these annotations to combine the two sets into one set on a higher level.",initiateCommitment,yes,requestCriticalWake,noticeCriticalRoom,requestDestination,1,confirmDestinationRoom,"RoomTeammate == Destination

Do a global replacement of this combination within the context of waking a critical victim.",inflection,helpMe,need,help,,,,,,,,,,,,,,,,,,,,,,,,,,,,,,,,,,,,,,,,,,,,,,,,,,,,,,,,,,,,,,,,,,,,,,,,,,,,,,,,,,,,,,,,,,,,,,,,,,,,,,,,,,,,,,,,,,,,,,,,,,,,,,,,,,,,,,,,,,,,,,,,,,,,,,,,,,,,,,,,,,,,,,,,,,,,,,,,,,,,,,,,,,,,,,,,,,,,,,,,,,,,,,,,,,,,,,,,,,,,,,,,,,,,,,,,,,
638,11,3,4,230,11:31,11:29,green,"asking about the stabilized victim he saw in the hallway. I needed to see this again to determine how I came up with the label about destination. Disclaimer that I need to write about in pre-registration: ""Which room is this?"" does sound the same as ""which one is this?"" This is one of the many phrases that I had trouble understanding. ",clarifySomething,no,collaborateCriticalWake,requestRoomTeammate,askStabilizedStatus,1,confirmDestinationRoom,"When I heard ""Which room is this?"" I would stand behind the label clarifyDestinationRoom because I thought it was about which sick bay to take this stabilized vicitm to from this particular room.

When I saw Loren's label about victim status, I questioned my hearing immediately because I know that 'room' and 'one' sound the same to me. Therefore I rewatched the video segment several times, with and without audio, to determine which is most plausible. Green only asks this question after the stabilied victim is within his FOV.

Therefore, I would now label this ""askStabilizedStatus"". Even so, it does not match Loren's label 100%. This victim is stabilized so the label ought to be Stabilized, not victim.

If and when annotation continues, I will need to continue writing about any and all complications due to my hearing loss. Fortunately, this has happened few times when I cannot resolve via FOV or another's set of ears that is already on the ToMCAT team.",which,whichOne,nil,is,,,,,,,,,,,,,,,,,,,,,,,,,,,,,,,,,,,,,,,,,,,,,,,,,,,,,,,,,,,,,,,,,,,,,,,,,,,,,,,,,,,,,,,,,,,,,,,,,,,,,,,,,,,,,,,,,,,,,,,,,,,,,,,,,,,,,,,,,,,,,,,,,,,,,,,,,,,,,,,,,,,,,,,,,,,,,,,,,,,,,,,,,,,,,,,,,,,,,,,,,,,,,,,,,,,,,,,,,,,,,,,,,,,,,,,,,,
638,12,3,4,230,11:21,11:23,green,"asking about the path to a location is clear, not asking about the location itself, not asking about the location as if it were a goal either. Asking about the path itself and whether it has rubble.",askInformation,no,collaborateCriticalWake,requestRoomTeammate,askClearNavigate,1,confirmDestinationRoom,"asking about the path to a location is clear, not asking about the location itself, not asking about the location as if it were a goal either. Asking about the path itself and whether it has rubble.

""location= position is subject
navigation=movement is subject
destination=position is the goal""

location instead of area

status is for victims and not for location. use clear.",is,isZone,nil,is,,,,,,,,,,,,,,,,,,,,,,,,,,,,,,,,,,,,,,,,,,,,,,,,,,,,,,,,,,,,,,,,,,,,,,,,,,,,,,,,,,,,,,,,,,,,,,,,,,,,,,,,,,,,,,,,,,,,,,,,,,,,,,,,,,,,,,,,,,,,,,,,,,,,,,,,,,,,,,,,,,,,,,,,,,,,,,,,,,,,,,,,,,,,,,,,,,,,,,,,,,,,,,,,,,,,,,,,,,,,,,,,,,,,,,,,,,
638,13,4,4,240,10:37,10:34,green,,clarifySomething,no,shareUniqueKnowledge,noticeMarker,clarifyMarker,1,answerStabilizedMarker,,what,whatIs,slang,slang,,,,,,,,,,,,,,,,,,,,,,,,,,,,,,,,,,,,,,,,,,,,,,,,,,,,,,,,,,,,,,,,,,,,,,,,,,,,,,,,,,,,,,,,,,,,,,,,,,,,,,,,,,,,,,,,,,,,,,,,,,,,,,,,,,,,,,,,,,,,,,,,,,,,,,,,,,,,,,,,,,,,,,,,,,,,,,,,,,,,,,,,,,,,,,,,,,,,,,,,,,,,,,,,,,,,,,,,,,,,,,,,,,,,,,,,,,
638,14,4,5,290,10:23,10:21,blue,,askInformation,no,prioritizeClearLocation,noAnnotatedCause,clarifyClearRoom,1,answerClearLocation,"status is for victims, not rooms or locations",have,haveWe,do,clear,,,,,,,,,,,,,,,,,,,,,,,,,,,,,,,,,,,,,,,,,,,,,,,,,,,,,,,,,,,,,,,,,,,,,,,,,,,,,,,,,,,,,,,,,,,,,,,,,,,,,,,,,,,,,,,,,,,,,,,,,,,,,,,,,,,,,,,,,,,,,,,,,,,,,,,,,,,,,,,,,,,,,,,,,,,,,,,,,,,,,,,,,,,,,,,,,,,,,,,,,,,,,,,,,,,,,,,,,,,,,,,,,,,,,,,,,,
638,15,4,5,290,10:17,10:15,green,,clarifySomething,no,collaborateCarryStabilized,carryStabilized,clarifyStabilizedStatus,1,confirmStabilizedStatus,"Victims carried and asked about were stabilized. This difference matters in other areas but not for labeling agreement.

Use clarify when asking about stabilized status (or confirm when aswering)",is,isOne,nil,is,,,,,,,,,,,,,,,,,,,,,,,,,,,,,,,,,,,,,,,,,,,,,,,,,,,,,,,,,,,,,,,,,,,,,,,,,,,,,,,,,,,,,,,,,,,,,,,,,,,,,,,,,,,,,,,,,,,,,,,,,,,,,,,,,,,,,,,,,,,,,,,,,,,,,,,,,,,,,,,,,,,,,,,,,,,,,,,,,,,,,,,,,,,,,,,,,,,,,,,,,,,,,,,,,,,,,,,,,,,,,,,,,,,,,,,,,,
638,16,5,6,350,9:30,9:28,green,,askInformation,no,prioritizeClearLocation,prioritizeClearLocation,clarifyClearRoom,1,answerMarkRoomer,"status is for victims, not location or rooms",did,didYou,did,check,,,,,,,,,,,,,,,,,,,,,,,,,,,,,,,,,,,,,,,,,,,,,,,,,,,,,,,,,,,,,,,,,,,,,,,,,,,,,,,,,,,,,,,,,,,,,,,,,,,,,,,,,,,,,,,,,,,,,,,,,,,,,,,,,,,,,,,,,,,,,,,,,,,,,,,,,,,,,,,,,,,,,,,,,,,,,,,,,,,,,,,,,,,,,,,,,,,,,,,,,,,,,,,,,,,,,,,,,,,,,,,,,,,,,,,,,,
638,17,6,6,360,9:20,9:17,green,,initiateCommitment,yes,collaborateCriticalWake,noticeLocationTeammate,requestDestination,1,navigateDestinationTeammate,"teammate doesn't modify anything. remove it.

loren's primitive == salena's abstract, therefore agree.",want,wantTo,want,come,,,,,,,,,,,,,,,,,,,,,,,,,,,,,,,,,,,,,,,,,,,,,,,,,,,,,,,,,,,,,,,,,,,,,,,,,,,,,,,,,,,,,,,,,,,,,,,,,,,,,,,,,,,,,,,,,,,,,,,,,,,,,,,,,,,,,,,,,,,,,,,,,,,,,,,,,,,,,,,,,,,,,,,,,,,,,,,,,,,,,,,,,,,,,,,,,,,,,,,,,,,,,,,,,,,,,,,,,,,,,,,,,,,,,,,,,,
638,18,7,6,370,8:46,8:44,blue,,askInformation,no,prioritizeClearLocation,prioritizeClearLocation,askLocationMarker,0,confirmClearRoom,primitive is about the marker but the subgoal is about clearing the area,did,didIt,did,look,,,,,,,,,,,,,,,,,,,,,,,,,,,,,,,,,,,,,,,,,,,,,,,,,,,,,,,,,,,,,,,,,,,,,,,,,,,,,,,,,,,,,,,,,,,,,,,,,,,,,,,,,,,,,,,,,,,,,,,,,,,,,,,,,,,,,,,,,,,,,,,,,,,,,,,,,,,,,,,,,,,,,,,,,,,,,,,,,,,,,,,,,,,,,,,,,,,,,,,,,,,,,,,,,,,,,,,,,,,,,,,,,,,,,,,,,,
638,19,7,6,370,8:41,8:37,green,,initiateCommitment,no,coordinateTeamPlan,prioritizeClearLocation,askLocationPlan,1,answerLocationPriority,coordinating a plan by location. both instances of salena being askLocationPriority and Loren being ask/clarifyPlan show the effect of answerLocation and the cause of prioritizeClearLocation.,do,doWe,do,want,,,,,,,,,,,,,,,,,,,,,,,,,,,,,,,,,,,,,,,,,,,,,,,,,,,,,,,,,,,,,,,,,,,,,,,,,,,,,,,,,,,,,,,,,,,,,,,,,,,,,,,,,,,,,,,,,,,,,,,,,,,,,,,,,,,,,,,,,,,,,,,,,,,,,,,,,,,,,,,,,,,,,,,,,,,,,,,,,,,,,,,,,,,,,,,,,,,,,,,,,,,,,,,,,,,,,,,,,,,,,,,,,,,,,,,,,,
638,20,7,7,420,8:18,8:17,red,,initiateCommitment,no,askSelf,noticeCriticalRoom,askCriticalWake,1,answerCriticalWake,asking with response expected; if no response expected then suggest.,do,doYou,do,want,,,,,,,,,,,,,,,,,,,,,,,,,,,,,,,,,,,,,,,,,,,,,,,,,,,,,,,,,,,,,,,,,,,,,,,,,,,,,,,,,,,,,,,,,,,,,,,,,,,,,,,,,,,,,,,,,,,,,,,,,,,,,,,,,,,,,,,,,,,,,,,,,,,,,,,,,,,,,,,,,,,,,,,,,,,,,,,,,,,,,,,,,,,,,,,,,,,,,,,,,,,,,,,,,,,,,,,,,,,,,,,,,,,,,,,,,,
638,21,7,7,420,8:05,8:03,green,responding to medic's clarification of a stabilized victim,clarifySomething,yes,collaborateCarryStabilized,noticeStabilizedRoom,confirmStabilizedStatus,1,carryStabilized,"Victims carried and asked about were stabilized. This difference matters in other areas but not for labeling agreement.

Use clarify when asking about stabilized status (or confirm when aswering)",inflection,thatIs,nil,is,,,,,,,,,,,,,,,,,,,,,,,,,,,,,,,,,,,,,,,,,,,,,,,,,,,,,,,,,,,,,,,,,,,,,,,,,,,,,,,,,,,,,,,,,,,,,,,,,,,,,,,,,,,,,,,,,,,,,,,,,,,,,,,,,,,,,,,,,,,,,,,,,,,,,,,,,,,,,,,,,,,,,,,,,,,,,,,,,,,,,,,,,,,,,,,,,,,,,,,,,,,,,,,,,,,,,,,,,,,,,,,,,,,,,,,,,,
638,22,10,8,500,7:39,7:35,green,,clarifySomething,yes,askTeamPlan,prioritizeClearLocation,askLocationPlan,1,answerClearLocation,coordinating a plan by location. both instances of salena being askLocationPriority and Loren being ask/clarifyPlan show the effect of answerLocation and the cause of prioritizeClearLocation.,right,sinceWe,are,go,,,,,,,,,,,,,,,,,,,,,,,,,,,,,,,,,,,,,,,,,,,,,,,,,,,,,,,,,,,,,,,,,,,,,,,,,,,,,,,,,,,,,,,,,,,,,,,,,,,,,,,,,,,,,,,,,,,,,,,,,,,,,,,,,,,,,,,,,,,,,,,,,,,,,,,,,,,,,,,,,,,,,,,,,,,,,,,,,,,,,,,,,,,,,,,,,,,,,,,,,,,,,,,,,,,,,,,,,,,,,,,,,,,,,,,,,,
638,23,10,8,500,7:32,7:30,red,,askInformation,no,collaborateClearLocation,clearLocation,clarifyInformationLocation,1,answerInformationRoom,if clarifying location and information and room then question label is clarifyInforamtionLocation,what,whatWas,nil,was,,,,,,,,,,,,,,,,,,,,,,,,,,,,,,,,,,,,,,,,,,,,,,,,,,,,,,,,,,,,,,,,,,,,,,,,,,,,,,,,,,,,,,,,,,,,,,,,,,,,,,,,,,,,,,,,,,,,,,,,,,,,,,,,,,,,,,,,,,,,,,,,,,,,,,,,,,,,,,,,,,,,,,,,,,,,,,,,,,,,,,,,,,,,,,,,,,,,,,,,,,,,,,,,,,,,,,,,,,,,,,,,,,,,,,,,,,
638,24,10,8,500,6:59,6:57,green,regarding the middle section/ cafeteria,askInformation,no,askInformationLocation,noticeRoom,askInformationRoom,1,answerRoom,location instead of area,are,areAll,nil,are,,,,,,,,,,,,,,,,,,,,,,,,,,,,,,,,,,,,,,,,,,,,,,,,,,,,,,,,,,,,,,,,,,,,,,,,,,,,,,,,,,,,,,,,,,,,,,,,,,,,,,,,,,,,,,,,,,,,,,,,,,,,,,,,,,,,,,,,,,,,,,,,,,,,,,,,,,,,,,,,,,,,,,,,,,,,,,,,,,,,,,,,,,,,,,,,,,,,,,,,,,,,,,,,,,,,,,,,,,,,,,,,,,,,,,,,,,
638,25,10,8,500,6:51,6:49,red,,clearLocation,no,clearRoom,noticeClearRoom,requestRoomSearch,1,navigateDestinationTeammate,Suggest is to tell and request is to ask. salenaPrimitive is flip of abstract and matches Loren,do,doYou,do,want,,,,,,,,,,,,,,,,,,,,,,,,,,,,,,,,,,,,,,,,,,,,,,,,,,,,,,,,,,,,,,,,,,,,,,,,,,,,,,,,,,,,,,,,,,,,,,,,,,,,,,,,,,,,,,,,,,,,,,,,,,,,,,,,,,,,,,,,,,,,,,,,,,,,,,,,,,,,,,,,,,,,,,,,,,,,,,,,,,,,,,,,,,,,,,,,,,,,,,,,,,,,,,,,,,,,,,,,,,,,,,,,,,,,,,,,,,
638,26,10,9,550,6:14,6:11,green,ask about the nature of the room,clarifySomething,no,askInformationLocation,noticeRoom,askInformationRoom,1,answerRoom,location instead of area,what,whatIs,nil,is,,,,,,,,,,,,,,,,,,,,,,,,,,,,,,,,,,,,,,,,,,,,,,,,,,,,,,,,,,,,,,,,,,,,,,,,,,,,,,,,,,,,,,,,,,,,,,,,,,,,,,,,,,,,,,,,,,,,,,,,,,,,,,,,,,,,,,,,,,,,,,,,,,,,,,,,,,,,,,,,,,,,,,,,,,,,,,,,,,,,,,,,,,,,,,,,,,,,,,,,,,,,,,,,,,,,,,,,,,,,,,,,,,,,,,,,,,
638,27,10,10,600,5:40,5:29,green,,clarifySomething,yes,collaborateClearLocation,suggestDestinationTeammate,clarifyDestination,1,confirmDestination,location instead of area,inflection,inflection,nil,nil,,,,,,,,,,,,,,,,,,,,,,,,,,,,,,,,,,,,,,,,,,,,,,,,,,,,,,,,,,,,,,,,,,,,,,,,,,,,,,,,,,,,,,,,,,,,,,,,,,,,,,,,,,,,,,,,,,,,,,,,,,,,,,,,,,,,,,,,,,,,,,,,,,,,,,,,,,,,,,,,,,,,,,,,,,,,,,,,,,,,,,,,,,,,,,,,,,,,,,,,,,,,,,,,,,,,,,,,,,,,,,,,,,,,,,,,,,
638,28,11,10,610,5:07,5:05,blue,,askInformation,no,collaborateCriticalWake,announceCriticalRoom,askLocationTeammate,1,answerLocationTeammate,,where,whereDid,did,go,,,,,,,,,,,,,,,,,,,,,,,,,,,,,,,,,,,,,,,,,,,,,,,,,,,,,,,,,,,,,,,,,,,,,,,,,,,,,,,,,,,,,,,,,,,,,,,,,,,,,,,,,,,,,,,,,,,,,,,,,,,,,,,,,,,,,,,,,,,,,,,,,,,,,,,,,,,,,,,,,,,,,,,,,,,,,,,,,,,,,,,,,,,,,,,,,,,,,,,,,,,,,,,,,,,,,,,,,,,,,,,,,,,,,,,,,,
638,29,11,10,610,4:42,4:40,blue,,clarifySomething,no,collaborateClearRoom,announceCriticalWake,askRoomTeammate,1,confirmClearRoom,This can be either asking or clarifying the room,which,whichRoom,nil,are,,,,,,,,,,,,,,,,,,,,,,,,,,,,,,,,,,,,,,,,,,,,,,,,,,,,,,,,,,,,,,,,,,,,,,,,,,,,,,,,,,,,,,,,,,,,,,,,,,,,,,,,,,,,,,,,,,,,,,,,,,,,,,,,,,,,,,,,,,,,,,,,,,,,,,,,,,,,,,,,,,,,,,,,,,,,,,,,,,,,,,,,,,,,,,,,,,,,,,,,,,,,,,,,,,,,,,,,,,,,,,,,,,,,,,,,,,
638,30,11,10,610,4:36,4:35,blue,Either asking if i2 has been cleared or if that area of the map has been cleared in general.,clarifySomething,yes,collaborateClearRoom,announceCriticalWake,clarifyLocationTeammate,1,confirmClearRoom,"location instead of area

status is for victims and not for location. use clear. 

Because there is amibuity in asking about the room or the area around that room the center of this player's concern is about the room specifically, since mentioned. This is why I will use the questionLabel = clarifyLocationTeammate.",inflection,inflection,nil,nil,,,,,,,,,,,,,,,,,,,,,,,,,,,,,,,,,,,,,,,,,,,,,,,,,,,,,,,,,,,,,,,,,,,,,,,,,,,,,,,,,,,,,,,,,,,,,,,,,,,,,,,,,,,,,,,,,,,,,,,,,,,,,,,,,,,,,,,,,,,,,,,,,,,,,,,,,,,,,,,,,,,,,,,,,,,,,,,,,,,,,,,,,,,,,,,,,,,,,,,,,,,,,,,,,,,,,,,,,,,,,,,,,,,,,,,,,,
638,31,11,10,610,4:35,4:33,blue,Either asking if i2 has been cleared or if that area of the map has been cleared in general.,clarifySomething,no,collaborateClearRoom,announceCriticalWake,clarifyClearRoom,0,confirmClearRoom,"location instead of area. status is for victims and not for location. use clear. Because there is amibuity in asking about the room or the area around that room the center of this player's concern is about the room specifically, since mentioned. This is why I will use the questionLabel = clarifyClearRoom. The player then confirms in the next question utterance that his intention is theh room, not the location or area.
I cannot conclude that my label and Loren's label are matched because I used neither location nor room. I used Teammate.",then,thenClear,got,clear,,,,,,,,,,,,,,,,,,,,,,,,,,,,,,,,,,,,,,,,,,,,,,,,,,,,,,,,,,,,,,,,,,,,,,,,,,,,,,,,,,,,,,,,,,,,,,,,,,,,,,,,,,,,,,,,,,,,,,,,,,,,,,,,,,,,,,,,,,,,,,,,,,,,,,,,,,,,,,,,,,,,,,,,,,,,,,,,,,,,,,,,,,,,,,,,,,,,,,,,,,,,,,,,,,,,,,,,,,,,,,,,,,,,,,,,,,
638,32,11,11,660,4:17,4:15,red,,collaborateVictim,yes,collaborateCarryStabilized,stabilizeVictim,requestCarryStabilized,1,confirmCarryStabilized,,want,wantGrab,want,grab,,,,,,,,,,,,,,,,,,,,,,,,,,,,,,,,,,,,,,,,,,,,,,,,,,,,,,,,,,,,,,,,,,,,,,,,,,,,,,,,,,,,,,,,,,,,,,,,,,,,,,,,,,,,,,,,,,,,,,,,,,,,,,,,,,,,,,,,,,,,,,,,,,,,,,,,,,,,,,,,,,,,,,,,,,,,,,,,,,,,,,,,,,,,,,,,,,,,,,,,,,,,,,,,,,,,,,,,,,,,,,,,,,,,,,,,,,
638,33,11,11,660,4:01,4:00,red,,clarifySomething,no,collaborateCarryStabilized,confirmCarryStabilized,clarifyStabilizedStatus,1,confirmStabilizedStatus,"Victims carried and asked about were stabilized. This difference matters in other areas but not for labeling agreement.

Use clarify when asking about stabilized status (or confirm when aswering)",what,whatType,nil,is,,,,,,,,,,,,,,,,,,,,,,,,,,,,,,,,,,,,,,,,,,,,,,,,,,,,,,,,,,,,,,,,,,,,,,,,,,,,,,,,,,,,,,,,,,,,,,,,,,,,,,,,,,,,,,,,,,,,,,,,,,,,,,,,,,,,,,,,,,,,,,,,,,,,,,,,,,,,,,,,,,,,,,,,,,,,,,,,,,,,,,,,,,,,,,,,,,,,,,,,,,,,,,,,,,,,,,,,,,,,,,,,,,,,,,,,,,
638,34,12,12,720,3:26,3:23,green,,askInformation,no,collaborateClearLocation,confirmClearLocation,askClearRoom,1,answerClearLocation,"status is for victims, not rooms or locations; ",did,didWe,did,check,,,,,,,,,,,,,,,,,,,,,,,,,,,,,,,,,,,,,,,,,,,,,,,,,,,,,,,,,,,,,,,,,,,,,,,,,,,,,,,,,,,,,,,,,,,,,,,,,,,,,,,,,,,,,,,,,,,,,,,,,,,,,,,,,,,,,,,,,,,,,,,,,,,,,,,,,,,,,,,,,,,,,,,,,,,,,,,,,,,,,,,,,,,,,,,,,,,,,,,,,,,,,,,,,,,,,,,,,,,,,,,,,,,,,,,,,,
638,35,12,12,720,2:59,2:59,blue,,clarifySomething,no,prioritizeCriticalVictim,prioritizeCriticalVictim,clarifyCriticalRoom,1,clarifyCriticalRoom,which--> clarify,which,whichRoom,nil,nil,,,,,,,,,,,,,,,,,,,,,,,,,,,,,,,,,,,,,,,,,,,,,,,,,,,,,,,,,,,,,,,,,,,,,,,,,,,,,,,,,,,,,,,,,,,,,,,,,,,,,,,,,,,,,,,,,,,,,,,,,,,,,,,,,,,,,,,,,,,,,,,,,,,,,,,,,,,,,,,,,,,,,,,,,,,,,,,,,,,,,,,,,,,,,,,,,,,,,,,,,,,,,,,,,,,,,,,,,,,,,,,,,,,,,,,,,,
638,36,13,12,7.3,1:59,1:55,red,,initiateCommitment,no,prioritizeCriticalVictim,prioritizeCriticalRoom,suggestRoomTeammate,1,clarifyRoom,"loren's label subsumes and supports salena's primitive label. therefore, agreement.",if,ifYou,want,wait,,,,,,,,,,,,,,,,,,,,,,,,,,,,,,,,,,,,,,,,,,,,,,,,,,,,,,,,,,,,,,,,,,,,,,,,,,,,,,,,,,,,,,,,,,,,,,,,,,,,,,,,,,,,,,,,,,,,,,,,,,,,,,,,,,,,,,,,,,,,,,,,,,,,,,,,,,,,,,,,,,,,,,,,,,,,,,,,,,,,,,,,,,,,,,,,,,,,,,,,,,,,,,,,,,,,,,,,,,,,,,,,,,,,,,,,,,
638,37,14,12,740,1:49,1:47,red,,clarifySomething,no,prioritizeCriticalVictim,prioritizeCriticalRoom,clarifyCriticalRoom,1,confirmCriticalRoom,"location instead of area. If area or location in utterance, use location, not room. If room number specified, use room. If series of rooms, use location.",what,whatRoom,did,say,,,,,,,,,,,,,,,,,,,,,,,,,,,,,,,,,,,,,,,,,,,,,,,,,,,,,,,,,,,,,,,,,,,,,,,,,,,,,,,,,,,,,,,,,,,,,,,,,,,,,,,,,,,,,,,,,,,,,,,,,,,,,,,,,,,,,,,,,,,,,,,,,,,,,,,,,,,,,,,,,,,,,,,,,,,,,,,,,,,,,,,,,,,,,,,,,,,,,,,,,,,,,,,,,,,,,,,,,,,,,,,,,,,,,,,,,,
638,38,14,13,790,1:30,1:27,red,,clarifySomething,no,collaborateCarryStabilized,noticeStabilizedLocation,clarifyStabilizedStatus,0,noAnnotatedEffect,"asking about victim, not room",what,whatIs,nil,is,,,,,,,,,,,,,,,,,,,,,,,,,,,,,,,,,,,,,,,,,,,,,,,,,,,,,,,,,,,,,,,,,,,,,,,,,,,,,,,,,,,,,,,,,,,,,,,,,,,,,,,,,,,,,,,,,,,,,,,,,,,,,,,,,,,,,,,,,,,,,,,,,,,,,,,,,,,,,,,,,,,,,,,,,,,,,,,,,,,,,,,,,,,,,,,,,,,,,,,,,,,,,,,,,,,,,,,,,,,,,,,,,,,,,,,,,,
638,39,14,13,790,1:21,1:19,green,,askInformation,no,clarifyStabilizedStatus,clarifyStabilizedStatus,askLocationTeammate,1,locateMedicIdstabilized,,where,whereAre,nil,are,,,,,,,,,,,,,,,,,,,,,,,,,,,,,,,,,,,,,,,,,,,,,,,,,,,,,,,,,,,,,,,,,,,,,,,,,,,,,,,,,,,,,,,,,,,,,,,,,,,,,,,,,,,,,,,,,,,,,,,,,,,,,,,,,,,,,,,,,,,,,,,,,,,,,,,,,,,,,,,,,,,,,,,,,,,,,,,,,,,,,,,,,,,,,,,,,,,,,,,,,,,,,,,,,,,,,,,,,,,,,,,,,,,,,,,,,,
